{
  "archive_manifest_version": "1.1.0",
  "generated_at_utc": "2026-03-08T05:26:45Z",
  "project_slug": "sample_project",
  "archive_state": "processed",
  "archive_folder": "C:\\Users\\alanh\\AppData\\Local\\Temp\\zip_inbox_apply_smoke_dataset\\sample_project\\_processed\\smoke_apply",
  "requested_sequences": [
    1,
    2
  ],
  "requested_filenames": [],
  "moved": [
    {
      "sequence": 1,
      "filename": "zip1_sample_project_core.zip",
      "from": "C:\\Users\\alanh\\AppData\\Local\\Temp\\zip_inbox_apply_smoke_dataset\\sample_project\\zip1_sample_project_core.zip",
      "to": "C:\\Users\\alanh\\AppData\\Local\\Temp\\zip_inbox_apply_smoke_dataset\\sample_project\\_processed\\smoke_apply\\zip1_sample_project_core.zip"
    },
    {
      "sequence": 2,
      "filename": "zip2_sample_project_validation.zip",
      "from": "C:\\Users\\alanh\\AppData\\Local\\Temp\\zip_inbox_apply_smoke_dataset\\sample_project\\zip2_sample_project_validation.zip",
      "to": "C:\\Users\\alanh\\AppData\\Local\\Temp\\zip_inbox_apply_smoke_dataset\\sample_project\\_processed\\smoke_apply\\zip2_sample_project_validation.zip"
    }
  ],
  "skipped": []
}
